{
  "$schema": "https://json-schema.org/draft/2020-12/schema",
  "$id": "https://example.test/schemas/order.schema.json",
  "title": "Order",
  "type": "object",
  "additionalProperties": false,
  "required": ["order_id", "customer", "items", "total", "timestamp"],
  "properties": {
    "order_id": {"type": "string", "pattern": "^ORD-[A-Za-z0-9-]{3,40}$"},
    "customer": {
      "type": "object", "additionalProperties": false,
      "required": ["id", "name", "email"],
      "properties": {
        "id": {"type": "string", "minLength": 1},
        "name": {"type": "string", "minLength": 1},
        "email": {"type": "string", "format": "email"}
      }
    },
    "items": {
      "type": "array", "minItems": 1,
      "items": {
        "type": "object", "additionalProperties": false,
        "required": ["sku", "quantity", "unit_price"],
        "properties": {
          "sku": {"type": "string", "minLength": 1},
          "quantity": {"type": "integer", "minimum": 1},
          "unit_price": {"type": "number", "exclusiveMinimum": 0}
        }
      }
    },
    "total": {"type": "number", "minimum": 0},
    "timestamp": {"type": "string", "format": "date-time"},
    "force_failure": {"type": "boolean"}
  }
}

